"Affected Condensates","Diseases","Dysregulation Type","PMID","Condensate markers"
"DEE660B4","null","Huashi baidu granules (HBG) decreased lung inflammation, mitigated fibrotic progression, and achieved near-complete structural restoration in a lipopolysaccharide (LPS)-induced acute lung injury (ALI) rat model. Furthermore, protein chip analysis revealed LPS-induced upregulation of pro-inflammatory cytokines IL-1β, IL-2, and TNF-α in rat lung tissues which were significantly attenuated by HBG treatment. Cell viability assays showed that HBG promoted A549 alveolar epithelial cell proliferation without cytotoxicity. In THP-1-derived M1-Mφs macrophages, ELISA analysis revealed that HBG suppressed LPS-induced IL-1β and TNF-α secretion by 72.1% and 63.1%, respectively. Flow cytometry analysis demonstrated that A549 cells exposed to conditioned media from treated M1-Mφs macrophages for 24 hours had reduced early apoptosis. RT-qPCR and western blot analyses revealed LPS-induced upregulation of G3BP1 and TIA1 mRNA/protein, with HBG normalizing expression levels. Immunofluorescence colocalization analysis confirmed elevated G3BP1/TIA1 fluorescence and SGs formation in an LPS-induced ALI rat model. HBG restored SGs colocalization rates to near-physiological levels.","40930288","P31483,Q13283"
"91857CE7","DOID:9119","NPM1c relocalizes from the nucleolus to the cytoplasm. Return of NPMc to the nucleus via gene editing induces cell growth arrest and differentiation in AML cultured cell lines OCI-AML3 and IMS-M2 and in primary AML cells. Targeted degradation of NPM1c, or treatment with the XPO1 inhibitor KPT-330/selinexor downreagulate HOX/Meis1 gene expression, induce cell growth and differentiation in AML cultured cells lines OCI-AML3 anf IMS-S2. Treatment of NPM1c/FLT3-IDT leukemic mice with KPT-330/selinexor prolonged animal survival, reduced leukemic liver infiltration, spleen wieghts and white blood cell counts.","30205049","P06748"
"91857CE7","DOID:9119","Growth competition assays in AML cell lines reveal that FBL knockdown resulted in increased cell cycle arrest (G0/G1 phase arrest), myeloid differentiation (CD11b+) and cell death, while flow cytometry show diminished leukaemia stem and progenitor cells (LSPCs; Lin‚àíCD34+CD38‚àí) and leukaemia stem cells (LSCs; Lin‚àíCD34+CD38‚àíCD99+Tim3+) after FBL depletion. Furthermore, primary AML patient cells confirm growth defects, myeloid differentiation, increased apoptosis and diminished colony formation upon FBL silencing. In immunodeficient non-obese diabetic (NOD)/severe combined immunodeficiency (SCID) mice transplanted with AML cells, knockdown of FBL led to slower leukaemia progression and extended survival, few leukaemic blast cells in the bone marrow, spleen, and liver, and a significant reduction in leukaemia cell frequencies in peripheral blood, bone marrow, and spleen. In HL-60 cells, deletion of the intrinsically disordered GAR domain and a chimeric FBL mutant, H2B-MD, with the GAR domain substituted with a non-IDR sequence from H2B failed to recover AML characteristics. Full restoration was observed using the MD-GAR mutant containing GAR and MD in revised order and the chimeric RGG-MD mutant with the FBL IDR replaced with a similar glycine- and arginine-rich sequence from NOLA1. Live-cell imaging of AML cells show GAR-defective mutants (MD, H2B-MD and PLD-MD) generated smaller puncta, failing to fully separate from fibrillar centre proteins and forming an incomplete hollow structure while RBD-defective mutants (GAR and GAR-Helix) exhibited fewer and larger condensates that dispersed across the nucleus yet still excluded fibrillar centre proteins. FRAP revealed GAR-defective mutants displayed higher mobility, as evidenced by faster fluorescence recovery after bleaching, and RBD-defective mutants (GAR and GAR-Helix) exhibited limited dynamics.","38745030","P22087,P06748"
"232F8A39","DOID:9119","Elevated levels of P-bodies that sequester mRNA encoding for tumor suppressors promote leukemia progression in vivo in AML mouse models.","39169219","Q6P2E9,P26196"
"DEE660B4","DOID:10652","Aβ42 causes SG formation in a cell type-specific manner and depends on eIF2α phosphorylation. Exposure to 20 μM Aβ42 led to significant SG formation in neuroblastoma-derived (SH-SY5Y) and glioma-derived (U87) cell lines, but not non-neuronal cell lines. Also, familial mutants Dutch E22Q and Flemish A21G display distinct SG-inducing characteristics. Monomeric and oligomeric forms of Aβ42 exhibit a 4–5 times stronger ability to induce SG formation compared to fibrillar forms. eIF2α kinases knockout (KO) cell lines show that Aβ-induced SG formation is dependent on Protein Kinase R (PKR). Proximity ligation assay (PLA) analysis show a close proximity of PACT and PKR in both Aβ-treated SH-SY5Y and U87 cells, and in Alzheimer's Disease (AD) mouse hippocampus indicating Aβ42 exposure facilitates PACT-PKR interaction.","39966464","P55884,Q13283"
"DEE660B4","DOID:10652","5XFAD AD mouse models subjected to anesthesia and surgery exhibit stress granule induction and localization of SYK and phosphorylated SYK within stress granules.","34512311","P43405,Q13283"
"03D56D03","DOID:10652,DOID:11870,DOID:678","BRCA1 aberrantly localizes into tau cytoplasmic aggregates in Alzheimer's disease (AD), Pick's disease (PiD), and progressive supranuclear palsy (PSP) patient brains.","31861888","P10636"
"DEE660B4","DOID:332","Upon treatment with sodium arsenite, immunocytochemistry for PABP in iPSC-derived hMNs from ATXN2-patients show stress granule (SG) defects. ATXN2-ALShMNs cells contain larger stress granules during the recovery phase. Additionally, immunohistochemistry for TUJ1 and CHAT on E13 DIV7 primary motor neuron cultures from ATXN2-Q33 TDP-43Tg-ALS mice show altered SG dynamics.","39209824","P11940"
"DEE660B4","DOID:332","In hFUS transgenic mice, the spinal cord at the end stage of the disease (39–41 days) is marked by a significant increase in the expression of hnRNP A2/B1 isoforms lacking exon 9 (A2b and B1b), downregulation of exon 9-containing isoforms (A2 and B1), and skipping of hnRNP A2/B1 exon 9 (31–36 days) occurs concomitantly with the appearance of disease symptoms. Immunofluorescence analysis on mouse primary cortical neurons shows Exon 9 skipping causes redistribution of hnRNP A2/B1 from the nucleus to the cytoplasm, and Exon 9 skipping increases hnRNP A2/B1 recruitment to SGs.","40157939","P22626,P31483"
"DEE660B4","DOID:9255,DOID:332","Cytoplasmic TDP-43 inclusions co-localize with stress granules markers in cellular models and ALS and FTLD-U patient brain tissue. Cytoplasmic inclusions of TDP-43 disease associated mutations correlate with increase in insoluble protein aggregates and cellular toxicity.","20948999","Q13148"
"DEE660B4","DOID:9255,DOID:332","DHX30 is recruited into FUS cytoplasmic puncta in ALS patient spinal motor neurons, causing mitochrondrial dysfunction and cytotoxicity","36163369","P35637,Q7L2E3"
"DEE660B4","DOID:0081292,DOID:332","Traumatic brain injury (TBI) in Drosphilla induces formation of stress granules (SGs) that co-localize with phosphorylated Ref(2)P and transiently recruit TBPH. Traumatic injury in Drosophila models of ALS (expressing FUS mutants or C9ORF72 repeat expansions) increase levels of Ref(2)P (p62 homologue), enhance animal mortality and locomotive dysfunction.","29432563","P35637"
"DEE660B4","DOID:332","Immunocytochemistry shows that stress granule (SG) component G3BP1 exhibits enhanced interaction with Nup107 in motor neurons derived from patient iPSCs carrying C9orf72 Amyotrophic lateral sclerosis (ALS) mutations, where C9-1 and C9-2 mutant lines exhibited an increased number of SGs and slower SG disassembly following arsenite treatment compared to controls. Co-immunoprecipitation of G3BP1 in iPSC-derived motor neurons (iMNs) revealed increased interactions of G3BP1 with 40 SG components. Neurodegeneration-relevant proteins HSPH1, UBA1, SEP9, and DDX6 were among detected proteins, and immunostaining experiments confirm DDX6 foci colocalize with G3BP1 in SGs. Moreover, Nup107 colocalizes with SGs and aggregates in C9-ALS iMNs. Knockdown of npp-5, the C. elegans ortholog of Nup107, alleviates ALS-associated phenotypes in worm models, including dipeptide repeats production via repeat-associated non-AUG translation, progressive motility decline, and reduced lifespan. Knockdown of npp-5 ameliorated the short lifespan phenotype of C9ubi ALS worms, whereas knockdown of a different nucleoporin, npp-10 (Nup98 ortholog), did not extend the lifespan of C9ubi ALS worms.","40891053","P26196,P31483,Q13283"
"DEE660B4","DOID:9255,DOID:332","Patient-derived fibroblasts expressing mutant TDP-43 or C9ORF72 repeat expansion formed more stress granules (SGs) compared to healthy controls upon exposure to sub-lethal levels of oxidative stress. Under chronic oxidative stress conditions, SG form at a lower level in disease versus healthy fibroblasts. TDP-43 co-localizes with SG only under chronic, but not acute stress conditions. Cells under chronic stress form phospho-TDP-43 fibrils and impair the autophagy pathway.","32827688","Q01085,Q13148"
"DEE660B4","DOID:9255,DOID:332","In a sporadic type B frontotemporal dementia (FTD) patient, mildly affected neurons retained nuclear TDP-43 but exhibited small cytoplasmic puncta displaying phosphorylated TDP-43 and intra-condensate demixing within stress granules. Severely affected neurons lost nuclear TDP-43 and displayed large cytoplasmic phosphorylated aggregates interacting with stress granules and showing demixing. In cells showing arsenite-induced demixing, FRAP reveals that TDP-43 dynamics gradually slowed while remaining dynamic under puromycin, indicating TDP-43 hardening during demixing. These demixed puncta were co-stained with HSPB1 and exhibited ubiquitination, linking demixing to TDP-43 aggregation in iPS-motor neurons. In rNLS8 mice, TDP-43 aggregation was absent without hTDP-43ΔNLS induction or in unaffected neurons with induction, and showed either strong colocalization of TDP-43 with stress granules or a distinct demixing pattern. In control postmortem brain samples TDP-43 was predominantly nuclear with no phosphorylated aggregates.","40412392","Q13148,Q13283"
"DEE660B4","DOID:9255,DOID:332,DOID:0060694","Inhibition of stress granule formation exacerbates disease phenotypes in Drosophila models of neurodegeneration and in cultured primary neurons.","39106168","Q13283"
"DEE660B4","DOID:332","Acute sublethal sodium arsenite treatment (ARS), as a positive control of oxidative stress, induced TDP-43 mislocalization from the nucleus to the cytoplasm, and cytoplasmic stress granule (SG) formation in human neuroblastoma SK-N-BE cells visualized via confocal microscopy. Semi-quantitative RT-PCR show loss of splicing activity upon chronic ARS treatment in human neuroblastoma cells, which induced features of TDP-43 loss and gain of function associated with TDP-43 proteinopathy. Rapamycin was able to significantly diminish formation of cytoplasmic phosphorylated TDP-43 SG in ALS patient-derived primary fibroblasts. Rapamycin also significantly decreased the percentage of patient-derived mC9orf72 iPSC-MNs with cytoplasmic phosphorylated TDP-43 aggregates from 34.3 % to 23.8 % and the percentage of SGs-forming cells from 12.7% to 4.2%.","39536963","Q13148"
"6F24707C","DOID:0060264,DOID:10907,DOID:332,DOID:12377","G135R rare mutation in VRK1 kinase destabilizes the kinase, reduces its half-life and prevents formation of Cajal bodies in HEK-293T cells.","31527692","P38432"
"38EC0B30","DOID:2841","Immunohistochemical staining reveal ovalbumin (OVA)-induced asthma mice models show colocalization of SUMO1 and TFEB. Immunoprecipitation (IP) of endogenous TFEB SUMOylation in BEAS-2B cells treated with OVA show increased levels of SUMO1 and TFEB. TFEB in AEC cells show increased levels of SUMOylated TFEB after OVA stimulation, suggesting SUMOylation of TFEB is related to allergic airway inflammation. In BEAS-2B cells, TFEB-K361R-EGFP (SUMOylation site mutant) formed increased number of puncta than TFEB-WT-EGFP specify cell line.  TFEB-K361R-EGFP also forms increased number of puncta in nuclei after starvation or OVA-stimulation for 6 h, while TFEB-WT-EGFP shows lowered number of puncta formation. Also, nuclear TFEB-K361R forms distinct puncta that colocalize with LAMP1 mRNAs of target genes during the formation of TFEB condensates, suggesting TFEB puncta are involved in transcription.","39998815","P19484"
"DEE660B4","DOID:3068,DOID:0081257","G3BP2 and TIAR-positive tress granules (hypoxic stress responses) are activated in low grade astrocytoma and glioblastoma (GBM) tissues, and correlate with poor patient ourcomes.","33203845","Q9UN86,Q01085"
"DEE660B4","DOID:0060041","DDX3X missense mutations cause formation of stress granules in primary neural progenitors and neurons. The DDX3X missense granules show differential protein composition and physical properties, with C-terminal missense mutations exhibiting reduced molecular exchange with the cytoplasm. Clinically severe DDX3X missense mutations induce DNA damage in neurons and accumulation of R-loops in the cytoplasm.","39836689","Q13283,Q7Z417"
"6F24707C","DOID:0111209","Compound heterogeneous mutations in VRK1 identified in sibling patients of Distal hereditary motor neuropathies (dHMNs). These mutations cause protein mislocalization from the nucleus to the cytoplasm and altered coilin expression in patients fibroblasts. VRK1 mutations lead to inhibition of Cajal body formation and impaired neurite length and branching in hiPSC-derived motor neurons.","31090908","P38432"
"232F8A39","DOID:3073","RNA sequencing analysis in U87MG human donor cells reveals that praja2 plays a role in the regulation of the transcriptional landscape in Glioblastoma multiforme (GBM). Proteomic analysis identified the RNA helicase DDX6 as a novel target of praja2 and in situ immunostaining analyis of U87MG cell lines confirm that a portion of praja2 signal partially colocalizes with DDX6 at P-bodies. Co-immunoprecipitation show praja2 co-purified with other components of P-bodies involved in translational repression, mRNA decapping, and RNA degradation. In U87MG and patient derived GBM cells, activation of cAMP stimulated the assembly of P-bodies in wild-type cells, whereas the number of P-bodies was reduced in praja2 KO cells, demonstrating that activation of GPCR-cAMP-PKA-praja2 axis promotes the assembly of P-bodies. Wild-type or praja2KO GBM cells injected into CD1 nude mice shows that tumor volume was markedly reduced in mice injected with praja2 KO cells compared to controls. Immunohistochemistry confirmed a marked reduction of the proliferative marker Ki67 in praja2 KO tumor samples compared to wild-type. Additionally, overexpression of DDX6 all K/R mutant markedly impaired condensation of P-bodies in Fsk-treated U87MG cells, and expression of the DDX6 ubiquitylation mutant strongly accelerated tumor growth in mice compared to wild-type DDX6.","40148504","P26196,Q9NPI6"
"804901D1","DOID:1612","ZNF32 H179A, H183A, and H179A, H183A mutations, but not WT, form nuclear speckles (NS) in ZR-75-30, MCF-7, and MDA-MB-231 breast cancer cells. MTT assay, chrystal violet staining, and EdU staining show ZNF32 single-site mutations (H179A, H183A) but not ZNF32 H179A, H183A and WT promote the proliferation of cells. Subcutaneous xenograft tumor model in nude mice show higher tumor volumes and tumor formation rates in H179A and H183A single-site mutations, but not ZNF32 H179A, H183A double mutations or WT group. Transcriptome sequencing data show ZNF32 H179A and H183A differentially upregulate ISY1-RAB43 and UPK3BL1 as well as downregulating SNX22 expressions.","40046230","P17041"
"DEE660B4","DOID:1612","Stress granules formation is accelerated in breast cancer patients with low levels of PTEN expression and is associated with poor progrnosis and antitumor immune response and drug resistance.","39080255","Q13283"
"DEE660B4","DOID:162","Environmental exposure to toxic heavy metal Cr(VI) induces stress granule formation to promote malignant properties, such as proliferation rate, sphere formation and malignant markers in human bronchial epithelium BEAS-2B cells.","39306064","Q13283"
"DEE660B4","DOID:162","Immunoflourescence microscopy of U2OS cells show that cells expressing the p53 DBD-depleted mutants have reduced percentages of cells harboring puncta as compared to those expressing p53 WT. Immunoblot analysis of H1299 cells expressing WT or site-specifically lactylated p53 show that the site-specifically lactylated p53 proteins failed to bind p53RE-DNA or condense into discrete nuclear puncta in response to stimuli. To examine the consequences of p53 lactylation, p53-/- HCT116 cells expressing either the empty vector (p53null), wild-type (p53WT), or the K120&K139-lactylated p53 (p53DualLac) were inoculated in mice and monitored for tumor growth. p53Dual-Lac was more tumorigenic than the p53WT, with levels of p53 K120 and K139 lactylation correlated with tumor volume. Additionally, p53-WT, but not the K120E and K139E disease variants, inhibit cellular proliferation, clone formation, and xenograft tumor growth in HCT116 cells.","38653238","P04637"
"E603CCA4","DOID:162","Cytoplasmic DDX4-positive, germ-like granules are observed in the cytoplasm of several cancer patient tissues, but not in the normal tissue. The aberrant condensates are further detected in xenograft tumors and spheroid models. DDX4 aberrant condensates are associated with transcriptional reprogramming, tumor growth, cancer invasiveness and poor patient survival.","38963760","Q9NQI0"
"38EC0B30","DOID:162","ZHX2 forms nuclear condensates in MCF7 cells, T47D cells, and tumors from MDA-MB-231 xenograft tumor-bearing mice and breast cancer patients, with the proline-rich ZHX2 IDR mediating hypoxia-induced LLPS. Fluorescence images, co-localization analysis, and immunoblots of lysates of MDA-MB-231 cells show that ZHX2 forms transcriptionally active condensates in hypoxia. Integration of data from ChIP-seq, RNA-seq, and an assay for transposase-accessible chromatin with high-throughput sequencing (ATAC-seq) reveal hypoxia-induced LLPS of ZHX2 activates a cluster of oncogene transcription that is enriched by metastatic genes distinct from the targets of hypoxia-inducible factor (HIF). LLPS-enhanced phosphorylation of ZHX2 at S625 and S628 partitions CTCF into condensates in MDA-MB-231 cells, and non-invasive bioluminescence imaging in mice and ex vivo imaging of lung tissue showed that ZHX2 depletion inhibited breast cancer lung colonization and outgrowth.","40185097",""
"91857CE7","DOID:162","Nucleoli are enlarged in rapidly proliferating cells, as measured by AgNOR staining, which stains for Ag-binding proteins localized to the nucleolous, primarily NPM1 and nucleolin. The number and histologic pattern of AgNOR staining allows patient stratification into high risk and low risk, across multiple types of cancer.","10588059","P06748,P19338"
"232F8A39","DOID:162","P body assembly is inhibited by highly phosphorylated EDC3 in tumor cells to promote tumor growth and invasion.","33586867","Q9NPI6,Q96F86"
"1AE015A9","null,null","Western blot analysis reveals that ALYREF expression was significantly reduced in doxorubicin (DOX)-treated mouse hearts, mouse cardiomyocytes (CMs), and human induced pluripotent stem cell-derived cardiomyocytes (hiPSC-CMs). In cardiac-specific ALYREF knockout mice (ALYREF CKO), echocardiography revealed that ALYREF CKO mice exhibited significant cardiac dysfunction, elevated creatine kinase-MB (CK-MB) and cardiac troponin T (cTnT), and enlarged left ventricular chambers and pathological cardiac hypertrophy. Cardiac-specific overexpression of ALYREF attenuates DOX-induced cardiotoxic injury in mice; following DOX treatment, mice with ALYREF overexpression exhibited improved survival and preserved body weight compared with controls. Echocardiographic analysis demonstrated that cardiac-specific overexpression of ALYREF significantly preserved left ventricular function, lowered serum levels of CK-MB and cTnT, and mitigation of DOX-induced myocardial atrophy and fibrosis compared to controls. Immunostaining in CMs show that following DOX exposure, ALYREF lost punctate nuclear organization and became diffusely distributed throughout the nucleoplasm with no nuclear translocation. Live-cell imaging of CMs transfected with EGFP-ALYREF confirmed that EGFP-ALYREF formed discrete nuclear condensates, with FRAP recovery occurring within 5 minutes of photobleaching. DOX induced DNA damage by binding to D171 and disrupted ALYREF condensates, indicated by increased γH2AX foci, greater comet tail DNA percentage, and higher nuclear fragmentation. DOX treatment of CMs additionally resulted in decreased binding of ALYREF to RBMX, TOP1, and CDC5L, and mutation of the D171 residue disrupted NARC1 complex assembly, resulting in DNA damage and apoptosis.","40899520","Q86V81"
"DEE660B4","DOID:0060694","Mutations in CAPRIN1 cause accumulation in cytoplasmic puncta and colocalize with other neurodegenerative disorder protein markers, including ataxia-related proteins and cause reduced neuronal activity in iPSC-derived neurons, and impaired stress granules dynamics","36136249","Q13283,Q53GS9,Q14444,Q9UJW0,Q9Y2T1"
"232F8A39","DOID:12140","T. cruzi infection induces P body assembly in HT1080 cell line, to supress the host immune response by inhibiting IL-1b production.","39122157","Q6P2E9,Q9NPI6"
"91857CE7","DOID:0070474","polyGly-Arg (GR) and polyPro-Arg (PR) dipeptides, formed through translation of C9ORF72 repeat expansion, localize to nucleolar substructures and impair biophysical properties of NPM1 in vitro, and disrupt nucleolar dynamics and function in HeLa cells. Additionally, GR and PR induce spontaneous assembly of poorly dynamic stress granules and impair translation. GR and PR directly interact with LCD-containing RNA-binding proteins and alter their biophysical properties, disrupting ribosome biogenesis.","27768896","P06748"
"DEE660B4","DOID:4928,DOID:10211","E. Coli infection promotes cGLIS3 circularization and assembly of stress granules (SGs), which in turn promotes ICC progression, demonstrated in colony formation assays and in mouse models of lung metastasis. Hepatolithiasis-ICC patients express higher level of cGLIS3 and poorer prognosis. Mechanisticallty, cGLIS3 forms a complex with hnRNPA1 and G3BP1 to promote SG and activate NF-kB signaling pathway.","38368261","Q13283"
"B4E97D43,97270867","null","In a chronic intermittent hypoxia (CIH) mouse model (exposed to intermittent hypoxia for 10 weeks), contextual memory tests and cued memory tests show that CIH exposure resulted in a significant impairment of fear memory.  Immunohistochemical analysis showed a decrease in TH-positive neurons in the ventral tegmental area (VTA), and transmission electron microscopy (TEM) revealed cytoplasmic vacuolization, severe nuclear deformation, increased lipofuscin accumulation, and mitochondrial damage in CIH-exposed mice. Golgi staining also showed a decreased dendritic spine number, reduced to about half, and lower density in the CIH group. Immunofluorescence and western blot analysis confirmed decreased TH expression and vital synaptic proteins PSD-95 and SYN, along with increased Œ±-syn expression in the VTA. Furthermore, microelectrode Array (MEA) showed that SH-SY5Y cells exposed to IH had significantly reduced action potential number, frequency, and amplitude. Additionally, immunofluorescence staining revealed that within the IH group, a marked reduction in fluorescence intensity of TH, PSD-95, and SYN occurred, while fluorescence of Œ±-syn was enhanced. Interfering with Œ±-syn expression by siSNCA alleviated the decrease in electrophysiological activity, improved function, and had higher levels of TH, PSD-95, and SYN, with increases of approximately 2-fold, 2-fold, and 10-fold, respectively in SH-SY5Y cells. FRAP experiments show that IH induced abnormal phase separation of Œ±-syn, leading to solid-like phase transitions and aggregation, which impeded fluorescence recovery. Confocal microscopy revealed that, with prolonged incubation times, the number and volume of Œ±-syn droplets increased following H‚ÇÇO‚ÇÇ treatment in SH-SY5Y cells. DCFH-DA fluorescent probe was utilized to reveal that under IH conditions in SH-SY5Y cells and CIH exposure in mice, ROS fluorescence intensity increased in SH-SY5Y cells and ROS content in the CIH group was approximately 3-fold higher, respectively. In SH-SY5Y cells, treatment with Danshensu methyl ester (DME) reduced ROS levels and inhibited Œ±-syn abnormal phase separation. FRAP experiments demonstrated that the fluorescence intensity of Œ±-syn droplets in SH-SY5Y cells recovered to approximately 80% of the initial value within 5 min post-bleaching when treated with DME, indicating high fluidity of these droplets. In mice, treatment with DME increased neuronal action potential number, frequency, and amplitude. Additionally, western blot and Immunofluorescence staining showed Œ±-syn aggregation was decreased, while expression of TH, PSD-95, and SYN proteins was increased. DME also alleviated the dopaminergic neuron damage and fear memory impairment caused by CIH.","41064882,41162854","O55042,P24529,Q62108"
