"Affected Condensates","Diseases","Dysregulation Type","PMID","Condensate markers"
"DEE660B4","DOID:8552","BCR-ABL oncoprotein accumulates into cytoplasmic granules in a panel pf Ph-positive cell lines, as detected by immunofluorescence. Expression of BCR-ABL-EGFP causes formation of cytoplasmic granules in HeLa and Cos-1 cells. These cytoplasmic granules exhibit liquid-like behavior, as inferred from granules fusion observed using live imaging. In HeLa cells, BCR-ABL-EGFP and localizes to stress granules in a tyrosine kinase activity-dependent manner. BCR-ABL granule formation is require to promote Ba/F3 cell proliferation.","31735741",""
"DEE660B4","DOID:4467","Patient-derived xenograft (PDX) and patient-derived organoid (PDO) models from samples obtained from a surgically resected clear renal cell carcinoma (ccRCC) patient treated with sunitinib examined by Western blot analysis show increased expression of UBAP2L. Additionally, in RCC cell lines 786-O and Caki-1, sunitinib-resistant cell lines exhibited increased UBAP2L protein expression as compared to parenteral cell lines. ccRCC patients with high UNAP2L expression also showed significantly higher resistance to sunitinib as compared with patients with ccRCC with low UBAP2L expression. In RCC cells lines, UBAP2L knockdown resulted in diminished cell viability, decreased maximal inhibitory concentration (IC50) values, and a reduction in both the number and size of colonies in ccRCC cells following sunitinib treatment, whereas overexpression elicited an opposing response. Furthermore, UBAP2L knockdown significantly increased the sensitivity of 786-O-R and Caki-1-R cells to sunitinib and promoted apoptosis, while overexpression decreased apoptosis and contributed to sunitinib resistance. In orthotopic xenograft model mice, sunitinib combined with UBAP2L knockdown impressively mitigated tumor growth compared with the control group, whereas UBAP2L knockdown or sunitinib alone exhibited a partial inhibitory effect. UBAP2L colocalized with stress granule (SG) marker protein G3BP1 following sunitinib treatment, and knockdown of UBAP2L disrupted SG organization--following sunitinib treatment, UBAP2L knockdown cells exhibited significantly lower levels of G3BP1 accumulation in the SG components. Additionally, immunoprecipitation and immunoblot found that S305 is the principal O-GlcNAcylation site of UBAP2L. UBAP2L S305A mutants exhibited reduced cell viability, diminished colony size and number, reduced angiogenic capacity, and disrupted SG formation in ccRCC cells. UBAP2L S305A mutant group showed slower tumor growth, smaller tumor size, and lower tumor weight in mice. Manipulation of O-GlcNAcylation via OSMI-1 treatment in tandem with sunitinib treatment shows inhibited cell growth and disrupted SG formation in ccRCC cells, slower tumor growth and enhanced survival in mouse models, and significant growth inhibition in PDOs.","41029457","Q14157,Q13283"
"38EC0B30","DOID:0060180","TFEB formed condensates under nutrition deprivation, and the N terminus CC domain is required for LLPS. Deletion of this domain inhibited TFEB-mediated target gene expression. TFEB condensates co-localize with EP300 and MED1 forming a transcriptional hub. TFEB inhibitors suppress TFEB puncta formation and abolish IF-mediated amelioration of DSS colitis.","39729151","P19484"
"232F8A39","DOID:9256","YAP expression increases the number of P bodies in cancer cells, in a mechanism dependent on YAP/TEAD transcriptional activity, to promote cell proliferation and migration.","39046443","P26196,Q9NPI6"
"91857CE7","DOID:0080600","Transfected coronavirus nucleoproteins from TGEV and MHV localize to nucleoli and disrupt cell division.","11533198","P19338"
"DEE660B4","DOID:0080600","SARS-CoV-2 infection leads to increased expression of HDAC6 in infected VERO, A549 and Calu-3 cell lines, and promoted viral replication. SARS-CoV-2 infection promotes interaction between G3BP1 and HDAC6, and between SARS-CoV-2 N protein and HDAC6, as measured by immunoprecipitation. Interaction of HDAC6 with the N protein stabilizes HDAC6, as a mechanism of increased expression. N protein expression inhibits formation stress granule induction in response to oxidative stress.","39135075","Q13283"
"DEE660B4","DOID:0080600","SARS-CoV-2 infection of ACE2 expressing HeLa cells inhibits stress granule (SG) formation in response to oxidative stress, to promote viral replication. SGs are formed in these cells when treated with sodium arsenite, poly(I:C) or SARS-CoV-2 RNA. G3BP1 and PKR are required for SG formation in response to SARS-CoV-2 RNA. Expression of the SARS-CoV-2 nucleocapsid protein is required for SG inhibition, through a mechanism that involves interaction with G3BP1 and PKR. This mechanism of SG  suppression by the viral nucleocapsid is shared between SARS-CoV, SARS-CoV-2 and MERS-CoV viruses.","34035218","Q13283,P31483"
"DEE660B4","DOID:12205","G3BP1 formed cytoplasmic SGs in uninfected arsenite-treated HEK 293T cells, but no SGs were detected in DENV-2-infected cells. DENV-2 dsRNA, DDX17, and G3BP1 were found to co-localize in infected cells, forming perinuclear aggregates. Western blot results confirmed that DDX17 interacts with G3BP1. Furthermore, DENV-2 mRNA levels were significantly increased in the DDX17 and G3BP1 co-transfection group at 24 hours post-infection, and plaque assays of the culture supernatant confirmed that viral titer was higher in the co-transfection group compared to the control.","40383034","Q13283"
"804901D1","DOID:1826,DOID:0112202","Nuclear speckles in dentate gyrus neurons - monitored via SRSF2 immunofluorescence, undergo morphological changes, including size and share distribution, upon neuronal activation in rat models of epileptic seizures. These morphological changes correlate with changes in transcriptional and splicing programming and protein composition within the nuclear speckles.","39197592","Q01130"
"BE404912","DOID:0080763","Circular RNA circSPECC1 directly interacts with ATG4B, promoting formation of cytoplasmic ATG4B condensates in gastric cancer (GC) cells, to drive ubiquitination and degradation of ATG4B and suppresses autophagy. This mechanism promotes metastasis in GC patient tissues. ATG4B recovers from photobleaching (FRAP) on the seconds timescale in cytoplasmic condensates formed in GC cells.","38433354","Q9Y4P1"
"1A18FFC4","DOID:0080763","Paraspeckle disintegration induced by WTX nuclear bodies (WTX-NBs) resulted in enhanced chemotherapy sensitivity and favorable prognosis in gastric cancer (GC). Co-immunoprecipitation and super-resolution microscopy reveal that the short isoform of WTX (WTX-S) specifically disrupted paraspeckle stability in human GC cell line AGS. Confocal fluorescence, immuno-electron microscopy (IEM), and bright-field observations show that WTX-S selectively interacted with and sequestered NONO (also as p54nrb) from paraspeckles, and that interactions between WTX-S and NONO induced formation of WTX-NBs. The coiled-coil domain 2 (WTX-CCD2) directly interacted with NONO-CCD to compartmentalize paraspeckle proteins and subsequently disrupt paraspeckle stability. FRAP assays showed NONO-WT mobility within WTX-NBs, with fluorescence recovery post-bleaching indicating shared fluidity with WTX-S condensates; both WTX-S and NONO puncta disassembled within 104s of 2.5% 1,6-HD treatment.  In MGC803, MKN45, and AGS cell lines, flow cytometry cell cycle, colony formation, wound-healing, invasion assay show that the synthetic peptide WTXAP, based on the WTX-NONO interface, mimicked WTX-NB-mediated paraspeckle disintegration and exhibited potent antitumor activity. In orthotopic xenograft tumor mouse models, immunohistochemical and immunofluorescence analysis show that WTXAP peptide exhibited potent antitumor activity in vivo. Additionally, in AGS cells, treatment with KPT-330 significantly increased the extent of WTX-S-mediated paraspeckle disintegration, sensitizing WTX-high GC to chemotherapy. FRAP assays indicated that KPT-330 increased the mobility of WTX-NBs while reducing their fluorescence recovery time after bleaching.","41115290","P23246,Q5JTC6-2,Q15233"
"DEE660B4","DOID:12930","Genetic variants in the nuclear localization signal of RBM20 hinder its nuclear import and formation of promote cytoplasmic pathogenic RNP granules. Reducing the level of RBM20 expression through treatment with antisense oligonucleotides (ASOs) significantly decreased cytoplasmic RNP granules within RBM20S639G cardiomyocytes. In RBM20S639G (serine-to-glycine substitution in the nuclear localization signal of RBM20) mice, ASO treatment reversed cardiac dysfunction and remodeling as shown by improving ejection fraction, decreasing severity of left ventricular chamber dilation, mitigating left ventricular hypertrophic remodeling, and improving ECG parameters.","40242865","Q5T481"
"DEE660B4","DOID:12930","Immunofluorescent staining in paraffin-embedded tissues and isolated single cardiomyocyte show an RBM20 S639G mislocalizes from nucleus to the sarcoplasm, with formation of protein condensates in the sarcoplasm. Differential expression and alternative splicing analyses show that components of stress granules were dysregulated in RBM20S639G mice when compared to WT, and genes associated with translational regulation were also differentially expressed in RBM20S639G mice. In vivo cardiac functional assessments show increased heart to body weight ratios in mutant two-month-old homozygous mice, but not in heterozygous mice.","35041844","Q5T481"
"DEE660B4","DOID:12930","Immunofluorescence staining of RBM20 mutations in H9c2 cells show that unphosphorylatable amino acid substitutes S638A, S640G, and S638/S640G facilitate export of RBM20 to the cytoplasm and assembly of ribonucleoprotein (RNP) granules. Phosphomimetic mutations S638D and S640D did not restore the nuclear localization. The non-phosphorylation site mutation P641L promoted RBM20 relocalization and the assembly of RNP granules. Transcriptome profiling with deep RNA-seq in RBM20 S637A KI male mice show altered gene expression associated with cardiac dysfunction and RNP granule assembly.","35394688","Q5T481"
"DEE660B4","DOID:12930","RNA-binding protein RBM20 undergoes mislocalization from the nucleus to the cytoplasm, where it forms aberrant ribonucleoprotein (RNP) condensates, in gene-edited humanized pigs expressing RBM20 mutant. These condensates resemble stress granules but are persistent and misregulated, disrupting RBM20�s normal role in nuclear RNA splicing. Gene-edited pigs harboring RBM20 mutations develop clinical and histological features of DCM: widespread splicing defects in cardiac genes, including titin (TTN), impair normal RNA processing, disrupt sarcomere structure and cardiac contractility. The condensatopathy is recapitulated in iPSC-derived cardiomyocytes; the sarcomere structure disruption is observed in DCM patient myocardium. Cytoplasmic condensates formed by mutant RBM20 in tranfected U2OS cells recover within seconds in FRAP experiments and exhibit wetting and beading properties on the nucleus surface.","33188278",""
"DEE660B4","DOID:0070310","METTL3 expression increases kanamycin-induced SG formation and attentuates apoptosis and ROS generation in kanamycin-treated HEI-OC1 cells. Kanamycin treatment in hair cells and HEI-OC1 cells cause decreases in METTL3 expression, and cells isolated from cochlear explants of P3 C57BL/6 mice also show decreased METTL3 expression. Administration of aminoglycosides to mice induce SG formation and decrease expression of METTL3 in the cochlea.","39193335","Q13283,P31483"
"75451661","DOID:4325","Infected Huh7 cells undergo dramatic morphological changes concomitant with nucleocapsid (NC) assembly, and have viral factory (VF) condensates which grow over time, associating with vimentin. Loosley coiled NCs were curved, indicating flexibility, and upon interaction with viral components, condense to thick-walled rigid cylinders in cytoplasmic VFs and a reduction in condensate fluidity.","39742805",""
"DEE660B4","DOID:0050204","BGLF2 is an EBV tegument protein expressed during the EBV lytic infection stage. BGLF2 expressed in 293T cells interacts with componnets of the RISC complex. Expression of BGLF2 in HONE-1 and HeLas cells induced stress granule (SG) formation, and co-localization of BGLF2 and RISC subunits within SGs. Expression of BGLF2 inhibits let-7a miRNA function and causes an increase in SUMO proteins.","35007297","Q13283"
"232F8A39","DOID:0050204","BGLF2 is an EBV tegument protein expressed during the EBV lytic infection stage. BGLF2 expressed in 293T cells interacts with componnets of the RISC complex. Expression of BGLF2 in HONE-1 and HeLas cells inhibited assembly of P bodies. Expression of BGLF2 inhibits let-7a miRNA function and causes an increase in SUMO proteins.","35007297","Q9NPI6"
"DEE660B4","DOID:3748","qRT-PCR and RNA fluorescence in situ hybridization (FISH) analysis shows that circG3BP1 was significantly and consistently upregulated in esophageal squamous cell carcinoma (ESCC) patient samples, where elevated expression of hsa_circ_0003967 was significantly associated with tumor location, histological grade, and advanced T and N stages, and predicted worse overall survival (OS) in patients with ESCC. In ESCC cell lines KYSE30 and TE1, CCK-8 and colony formation assays show circG3BP1 promotes ESCC cell proliferation and suppresses senescence under cisplatin-induced stress. Xenograft mouse models further confirm that circG3BP1 knockdown suppressed, while circG3BP1 overexpression promoted tumor growth, with these effects being more pronounced upon cisplatin treatment. RNA pull-down, RNA FISH, and immunofluorescence assays show that circG3BP1 translocation to SGs is mediated by IGF2BPs through m6A modification. Furthermore, circG3BP1 interacts with SG components TIAR and CAPRIN1, and circG3BP1 facilitates nucleate SG aggregation by reinforcing TIAR-CAPRIN1 interaction. Under cisplatin-induced stress, IGF2BPs facilitate the m6A-dependent translocation of circG3BP1 to stress granules (SGs), where it functions as a scaffold to enhance TIAR-CAPRIN1 interactions, thereby promoting SG nucleation. SG formation suppresses the translation of senescence-associated mRNAs, such as p21, delaying chemotherapy-induced cellular senescence and contributing to cisplatin resistance in ESCC cells via sequestration within SGs, thereby functioning as a translational gatekeeper of the p21-mediated senescence axis. Clinically, elevated circG3BP1 expression is associated with cisplatin resistance in patients with ESCC. These findings reveal a previously uncharacterized m6A-dependent mechanism by which circG3BP1 promotes SG-mediated chemoresistance, providing a promising potential biomarker and therapeutic target for ESCC treatment.","41037404","Q01085,Q14444"
"D3EAE6DE","DOID:3369","Aberrant transcriptional condensates formed by EWS-FLI1 fusion oncogene induces gene activation at GGAA microsatelite-target genes and drive oncogenic transformation in cultured cells. EWS-FLI1 condensates are dynamic, as demonstrated by fluorescence recovery after photobleaching (FRAP), fluorescence correlation spectroscopy (FCS) and live-cell particle tracking (SPT).","29930090",""
"DEE660B4","DOID:0060213","Arginine-rich dipeptide repeat proteins (R-DPR) binds to N-terminal fragments of FUS to promote phase separation. Kapβ2 prevents and reverses the aggregation and LLPS of wild-type FUS in the presence of arginine-rich dipeptide repeats in vitro. NLS-binding deficient Kapβ2W460A:W730A is more efficient in preventing poly(GR) recruitment into stress granules, reduces (GR)100 aggregation and counteracts neuronal toxicity of poly(GR) in primary cortical neurons without affecting normal FUS phase separation.","39747573","Q13283,P35637"
"DEE660B4","DOID:2326","In ST cells, SG formation enhances antiviral innate immunity mediated through the retinoic acid-inducible gene I (RIG-I) signaling pathway, thereby inhibiting TGEV replication. TGEV counteracts SG formation by reducing protein levels of G3BP1 to promote its own replication, with NSP1 exhibiting the strongest inhibitory effect on SGs formation.","40239441","Q13283"
"DEE660B4","DOID:3068","Lobeline impairs glioblastoma (GBM) cell survival by impairing SG disassembly after hypoxia in immortalized U251 and primary human U3085 GBM cells. After a hypoxic challenge, lobeline "locked" cells in a stressed state, even after re-exposure to normoxia. This is characterized by retained SGs, elevated levels of phosphorylated eIF2Œ± and a sustained reduction in global protein translation. The disruption of the canonical stress response induced by lobeline resulted in increased cell death in both GBM cell lines.","41053069","Q01085,Q9UN86"
"DEE660B4","DOID:10881","Infection of HeLa cells with four different members of the enterovirus (EV) suppressed stress granule (SG) formation and activation of type I IFN-dependent gene transcription. These mechanisms are mediated by the EV 2Apro and require its protease activity.","30867299","Q9UN86,P31483"
"DEE660B4","DOID:10881","FMDV infection of αvb6 cells leads to inhibition of stress granule formation (SG) under oxidative stress conditions, in a mechanism dependent on the catalytic activity of the viral proteases Lpro and 3Cpro, which cleave G3BP1 and G3BP2.","30404792","Q9UN86,Q13283,P31483"
"DEE660B4","DOID:11934","Western blotting analysis and immunofluorescence staining of tumor and adjacent non-tumor head and neck cancer (HNC) tissue samples show that protein levels of stress granule (SG) markers G3BP1 and PABP were higher in tumor (T) samples than non-tumor (N) samples, with distinct puncta in the cytosol of T samples only. Immunofluorescence microscopy of FaDu cells show that HSP90 inhibitor 17AGG decreased TBK1 activity and the number of cells displaying SGs in cells experiencing proteotoxic stress induced by MG132, but not in the absence of stress stimuli. Additionally, treatment with chemotherapeutic drug cisplatin significantly induced SG formation, while TBK1 knockdown reduced SG-positive cells by approximately 46%. Additionally, FaDu cells transfected with NC, TBK1, ATG5, or G3BP1 siRNAs treated with cisplatin showed cleaved CASP3 levels were higher in siTBK1- and siG3BP1-treated cells compared to siATG5-treated cells. Use of novel TBK1 inhibitor, GSK8612 suppresses xenograft tumor growth in vivo. p-TBK1 expression in tumors was reduced in GSK8612-treated mice compared to control mice, and immunofluorescence of tumor sections revealed that SGs were significantly reduced in GSK8612-treated tumors compared to control tumors.","40114316","P11940,Q13283"
"1A18FFC4","DOID:0080547,DOID:684","Palmitic acid (PA) and oleic acid (OA) applied to tumor-tissue derived organoids and hepatocellular carcinoma (HCC) cell lines (HepG2, HCCLM3, Huh7, Hep3B) were employed to imitate pathological lipid overload in metabolic dysfunction-associated steatohepatitis (MASH). Organoids reveal m6A-modified circTACC3 is up-regulated in MASH-related HCC. Additionally, circTACC3 functionally facilitates the growth, lipid accumulation, and adaptive survival of organoids and HCC cells under lipid overload condition in a manner depending on its expression and location. circTACC3 interacted directly with NONO/p54nrb to assemble intranuclear paraspeckles. Fluorescence lifetime imaging microscopy-Forster resonance energy transfer (FLIM-FRET) assays further validated a direct interaction between circTACC3 and NONO/p54nrb. This process was dependent on the m6A-modification sites of circTACC3 and facilitated its nuclear retention. DRIP-ChIRP-sequencing demonstrated that circTACC3-containing paraspeckles were recruited to DNA double-strand break (DSB) foci to form R loops (DSB-circTACC3-R loops). DSB-circTACC3-R loops further facilitated the contact and fusion of topologically associated domains (TADs) and selectively activated genes related to the malignant phenotype of MASH-related HCC. circTACC3-R loops exerted positive feedback control over the assembly of circTACC3 paraspeckle and clustering of TADs.","41103024","Q15233"
"DEE660B4","DOID:684","Missense mutp53 conferred better overall survival to hepatocellular carcinoma (HCC) patients compared to p53null patients. Knockdown of mutp53 in Huh7 (p53Y220C), SNU449 (p53A161T), and HepG2 (p53wt) HCC cells or overexpressed p53R175H-3XFLAG in p53null Hep3B HCC cells treated with sorafenib (SOR), vincristine (VCR), doxorubicin (DRB), or cisplatin (CDDP) reveal mutp53-expressing Huh7, SNU449, and Hep3B cells showed increased apoptosis compared to p53-knockdown or -null cells following SOR and VCR treatment, but not DRB or CDDP treatment. Additionally, immunofluorescence for CC3 and colony formation assays show mutp53-expressing KHOS/NP cells had more apoptotic cells with reduced colony formation than mutp53-knockdown cells treated with ER-stress inducer, thapsigargin (TG). Overexpression of p53R175H in p53null Hep3B HCC cells and OSC19 head and neck cancer cells resulted in increased apoptosis following TG treatment. Knockdown or knockout of mutp53 significantly increased the number of SG-positive cells following TG treatment in KHOS/NP, PLC/PRF/5 (p53R249S, HCC), and SNU449 cells. Knockdown of mutp53 in SNU449 and Huh7 HCC cells resulted in a consistent and significant increase in eIF2α phosphorylation (p-eIF2α) and increase in p-PERK following TG treatment. Increased PABP- or eIF4E SG formation due to mutp53 knockdown was reduced by simultaneous G3BP1 knockdown in both SNU449 and KHOS/NP cells following SOR and TG treatment. Hep3B cells expressing FL p53R175H and deletion mutants treated with SOR reveal that the OD domain in mutp53 is required for the mutp53-G3BP1 interaction. Immunocompromised mice bearing control and mutp53-knockdown Huh7 tumors show that mutp53-expressing control tumors responded to SOR, while mutp53-knockdown tumors show reduced sensitivity to SOR. Immunohistochemistry for p53 and CC3, as well as immunofluorescence for PABP and G3BP1 show increased CC3 positivity and a reduced frequency of SG formation in SOR-treated control tumors compared to mutp53-knockdown tumors.","40064891","P11940,Q13283,P06730"
"6F24707C","DOID:2476","The kinase inactive VRK1-D263G mutant is found in HSP patients with neurologic phenotype and moderate intellectual disability. The mutation causes loss of kinase function in VRK1. When expressed in HeLa cells, the mutant inhibits assembly of Cajal bodies.","34504951","P38432"
"A0DCDA94","DOID:2476","The kinase inactive VRK1-D263G mutant is found in HSP patients with neurologic phenotype and moderate intellectual disability. The mutation causes loss of kinase function in VRK1. When expressed in HeLa cells, the mutant inhibits formation of DNA damage response bodies detected via 53BP1 foci.","34504951","Q12888"
"DABB4E53","DOID:8566","LANA bodies are viral episomes, located in the nucleus of the host cell, containing viral genome and the KSHV protein LANA, which form via phase separation. LANA bodies are dynamic structures that change during the cell cycle and viral life cycle. The host protein DAXX localizes to LANA bodies under latent infection, and it is ejected during the transition to lytic replication. LANA bodies form ring-like microscopic structure that associate with KSHV DNA during lytic reactivation.  1,6-hexanediol treatment partially dissolves LANA bodies and alters KSHV genome conformation.","33471863","P38432"
"AA62C26E","DOID:526","ORC1 is a host factor that associates with the HIV-1 promoter and host repressive epigenetic factors within nuclear condensates to maintain enriched repressive histone modifications (HDAC1, HDAC2) on the HIV-1 promoter, as a mechanism for maintaining HIV-1 latency in J.Lat cells. ORC1 regulates DNA methylation of the HIV-1 promoter, through interactions with DNMT1. ORC1 form nuclear condensates and co-localizes with HP1a, SUV39H1, EZH2, H3K9me3, H3K27me3 in ORC1-GFP transfected HEK293 cells. The ORC1 nuclear condensates recover from photobleaching (FRAP) on the timescale of tens of seconds, and exhibit fusion and fission, demonstrating liquid-like fluidity. GFP-ORC1-IDR forms condensates in vitro in a concentration-dependent fashion; the in vitro condensates dissolve with increase in buffer ionic strength. Depletion of ORC1 reactivated HIV-1 in primary CD4+ T-cells from people living with HIV-1.","39082875",""
"C4086E78","DOID:526","HIV-1 membraneless organelles (HIV-1-MLOs) persist in macrophage-like cells (THP-1) in the presence of nevirapine, and build during in vivo infection of mice. Immune RNA-FISH and the MCP-MS2 system show that CPSF6 condensates co-exist with active proviruses and shield viral RNA genome. CPSF6 condensate disassembly impedes nuclear viral reverse transcription after nevirapine removal in THP-1 cells. HIV-1 MLOs shield the final reverse transcription product from host immune detection.","39623137",""
"DEE660B4","DOID:1273,DOID:8469","Stress granules assembly is induced by viral infections in cells containing high but not low levels of copy-back viral genomes.","37983241","Q01085,Q13283"
