"Affected Condensates","Diseases","Dysregulation Type","PMID","Condensate markers"
"904EB3AA","DOID:5082","Baicalein (BA) significantly attenuated liver injury (AST and AST decreasing), inflammation (interleukin-6, interleukin-8 and tumor necrosis factor-alpha decreasing, and collagen deposition in carbon tetrachloride (CCl4)-induced fibrotic mice. In transforming growth factor-Œ≤1-activated LX-2 human hepatic stellate cells (HSC), BA suppressed cellular activation while inducing senescence through G1-phase cell cycle arrest and glycolysis inhibition (lactate decreasing). BA directly bound to CEBPZ, suppressing its LLPS and subsequently enhancing TP53 transcription. This activation of the p53/HK2 axis drove HSCs senescence and attenuated fibrosis. Pharmacological inhibition of p53 with pifithrin-Œ± hydrobromide abolished BA's anti-fibrotic effects. BA's anti-fibrotic efficacy was entirely lost in CEBPZ-knockdown models.","41075517","P52789"
"91857CE7","DOID:3910","USP39 is a deubiquitylating enzyme that undergoes LLPS in the nucleolus through the N-terminal disordered region. USP39 silencing leads to growth and migration inhibition in lung adenocarcinoma A549 and H1299 cell lines. MTT, colony formation and transwell assays show that absence of the USP39 IDR region and the C-terminal domain damages the oncogenic activities of USP39 in lung adenocarcinoma. Transcriptomic analysis revealed that phase-separated USP39 was associated with GLI1 expression. Western blots of lung cancer and adjacent normal tissue pairs show elevated protein levels of USP39 and GLI1. Analysis of the association between patient survival and mRNA levels show high expression of GLI1 were associated with poorer prognosis.  USP39 knockdown suppresses GLI1 expression, and USP39 knockdown effectively hinders xenograft growth in athymic nude mice.","39885503","USP39"
"38EC0B30","DOID:3910","SP1 expression levels are higher in LUAD tissues compared to normal lung tissue. SP1 forms condensates at the superenhancer site that controls RGS20 transcription to promote cell proliferation and metastasis.","38976739","P08047"
"DEE660B4","DOID:0080208","A gene knock-down model of G3BP1, a core SG molecule, in mice and HepG2 cells was constructed to explore the role of SGs in metabolic dysfunction-associated fatty liver disease (MAFLD) induced in vivo by a high-fat diet or in cellulo by palmitic acid (PA). G3BP1 and TIA1 expression were upregulated in both PA-induced HepG2 cells and high-fat diet-fed mouse liver tissues, and showed increased colocalization in the livers of obese but not lean mice. G3BP1 deficiency aggravated liver lipid deposition and insulin resistance in obese mice, confirmed via PA-induced hepatocytes. RNA-seq show G3BP1 slowed down MAFLD progression by inhibiting APOC3.","40230220","Q13283"
"232F8A39","DOID:2377","PSMB8 undergoes alternative splicing to i2R-PSMB8 in MS white matter lesions (WMLs). Quantification of EDC4 indicate induced P-body formation in primary human cortical astrocytes, leading to phosphorylation of UPF1 and thus increased nonsense-mediated decay (NMD). P-body load is increased in postmortem MS lesions within astrocytes, potentially indicating a dysregulation in splicing of many genes within the MS white matter lesions.","38812791","Q6P2E9"
"DEE660B4","DOID:5844","Stress granule levels are reduced in vivo, in a diabetes ischemia-reperfusion rat model, and in a high glucose hypoxia/reoxygenation cell model and correlate with increased myocardial tissue damage, apoptosis and inflammatory factors.","38988216","Q13283,P31483"
"6A1B29D1","DOID:4964","Image-based high-throughput screening of MCF-7 cells show that the phosphatidylinositol 3-kinase (PI3K)/AKT signaling axis meditates A-body formation during stress exposure, with AKT activation repressing glycogen synthase kinase-3 (GSK3)-mediated degradation of c-Myc. qPCR showed that inhibitors of PI3K (Pilaralisib, Torin1, Ipatasertib), mTORC1/2, and AKT reduced heat-mediated induction of rIGS16RNA without affecting GAPDH mRNA levels, observed in siRNA-mediated depletion of AKT1 as well. c-Myc accumulates in the nucleolus during heat shock to induce rIGS16RNA expression. In MCF-7  and U-87 MG cells, depletion of c-Myc using siRNA reduced both A-body formation and levels of rIGS16RNA expression under heat shock conditions without affecting GAPDH, suggesting that c-Myc activity is involved in this amyloid aggregation pathway.","40272983",""
"91857CE7","DOID:4964","In MCF-7 cells, c-Myc accumulates in the nucleolus during heat shock to induce rIGS16RNA expression. qPCR shows this occurs prior to the heat-induced expression of rIGS16RNA, highlighting that nucleolar localization is not mediated by rIGSRNA itself.","40272983","P22087,Q99417"
"B5B9A610","DOID:1752","Anti-m1A dot-blot assay show ocular melanoma samples present attenuated m1A levels and increased ALKBH3 protein levels. Kaplan–Meier curves of tumor recurrence reveal poor outcomes with elevated ALKBH3 levels. ALKBH3-deficient ocular melanoma cells (92.1, OMM2.3 and CRMM1) show an increase of m1A levels, and and attenuation of cell growth, colony forming capacity, and decreased migration capacity. Injection of luciferase-labeled control and ALKBH3-silenced 92.1 melanoma cells into nude mice show a weaker signal intensity in ALKBH3-deficient ocular melanoma cells than in control cells. Correlation analysis of the relative protein expression of ALKBH3 and H3K18la level in ocular melanoma cells and normal melanocytes, and CUT&Tag and ChIP-seq of H3K18la analysis reveal histone lactylation enhances ALKBH3 expression. Western blot, RNA-seq, and qPCR reveal decreased RNA expression level of SP100A in ocular melanoma cells, and immunofluorescence of clinical samples show that SP100A was significantly decreased in the ocular melanoma samples. Overexpression of SP100A result in increased PML protein levels and an increase of PML bodies in ocular melanoma cells. Also, ALKBH3-deficient ocular melanoma cells exhibit an elevation in PML bodies.","38118002","P29590"
"DEE660B4","DOID:367","Corticospinal axons in injured spinal cord contain more G3BP1-TIA1 granules in mice with a rostralized progenitor graft, which does not support regeneration, than those with a caudalized progenitor graft. Immunofluorescence of axons performed at 20 days after spinal cord injury/peripheral nerve graft (PNG) placement showed more axons extending further distances from the spinal cord/PNG apposition in the G3BP1 B-domain-BFP expressing mice compared to the G3BP1-BFP and GFP expressing mice. Additionally, immunofluorescence of retinal ganglion cells (RGCs) from an optic nerve injury mouse model showed that G3BP1 B-domain expression in RGCs greatly increases axon regeneration. G3BP1 B-domain expression in reticulospinal neurons and RGCs resulted in smaller and fewer G3BP1 granules in the axons compared to G3BP1 and control GFP expression, and transduction with AAV2-G3BP1 B-domain-BFP increased postinjury RGC survival compared to controls. Also, injection of a cell-permeable G3BP1 B-domain peptide increases nerve regeneration in mouse mid-thigh sciatic nerve crush injuries. G3BP1 192-205 (EP7) CPP significantly reduces both the density and size of axonal G3BP1 granules in embryonic rat cortical neurons.","40014573","Q13283,P31483"
"D417733D","DOID:11476","Plectin (Plec) enhances osteoblast differentiation and bone formation via its intrinsically disordered region (IDR)-mediated phase separation. Plectin promotes osteoblast differentiation by sequestering Anxa2 through phase separation. Furthermore, the functional amino acid region (aa 1967‚Äì2185) of plectin exhibited therapeutic effect in ovariectomized and hindlimb unloading (HLU) mice.","41047030","P07356,Q9QXS1"
"DEE660B4","DOID:11476","Expression of HuR levels and HuR-positive stress granules (SG) positively associate with bone formation, with lower levels observed in older patients. HuR overexpression increased G3BP1 and Colla1 gene and protein expression and promoted SG formation in MC3T3-E1 cells. HuR overexpression increased G3BP1 and Runx2 gene and protein expression, promoted SG formation and induced osteogenic markers in mouse primary osteoblasts. HuR overexpression increased mRNA and protein levels of β-catenin, recruits β-catenin into SGs in MEC3T3-E1 cells. to facilitate osteogenesis in aging. Treatment with HuR activator, apigenin, enhances HuR expression, SG induction and recruitment of β-catenin and promotes osteoblast differentiation in MC3T3-E1 cells. In vivo, in OVX mouse models, treatment with apigenin promoted HuR, G3BP1 mRNA and protein expression, osteogenic gene expression and bone formation.","38375951","Q13283,Q15717"
"DEE660B4","DOID:2394","Site-specific MARylation of RACK1 is required for stress granule assembly, and depletion of TARG1 enhances stress granule assembly by increasing RACK1 MARylation. RACK1 mutant inhibits the formation of G3BP1 foci in OVCAR3 cells, and both knockdown and chemical inhibition of PAPR14 reduces RACK1 MARylation and reduces stress granule assembly, showing PARP14-mediated, site-specific MARylation of RACK1 drives stress granule assembly. Loss of RACK1 MARylation sensitizes OVCAR3 cells and OVCAR3 xenograft tumors grown in immunodeficient mice to stress and inhibits their growth.","39760726","Q13283"
"DEE660B4","DOID:1793","In human pancreatic cancer cell lines MiaPaCa-2, HPAC, Panc-1, and SU.86.86, individual cancer cells within cell populations show a high degree of heterogeneity in SG levels under various stress stimuli. Single cell analysis across cell-cycle phases in MiaPaCa-2 cells using a Fluorescent Ubiquitination-based Cell-cycle Indicator (FUCCI) system reveal that compared to cells marked as G1- and S113 phase, cells marked as G2-phase had ~6x higher levels of SGs, and S-phase showed a ~1.5x increase in SG levels compared to G1-phase cells. Also, SG levels were higher in G2-phase cells, G1 and S-phase cells showing low levels of SGs. Levels of 15d-PGJ2 were ~10-20x higher in G2-phase cells compared to asynchronous cells, and supplementation of asynchronous cells with increasing concentrations of exogenous 15d-PGJ2 enhanced SG levels up to the levels of G2-phase cells (but supplementation of G2-phase cells with the same concentrations of exogenous 15d-PGJ2 had no impact on SG formation capacity). Treatment of MiaPaCa-2 and HPAC cells with L-PGDS specific inhibitor AT-56 reduced SG formation in ~9x in G2-phase and ~3x in asynchronous cells. Additionally, cPLA2 is specifically required for the enhanced SG formation in G2- 266 phase, and knockdown of cPLA2 by doxycycline-inducible shRNA impaired SG formation in pancreatic cancer cells synchronized in G2-phase, but not in asynchronous cells. In pancreatic cancer cell tissue samples from orthotopic mouse models of pancreatic ductal adenocarcinoma, SG levels were ~3x higher in Geminin positive (S/G2) cells than in Geminin negative (G1) cells indicating that SG formation is influenced by cell-cycle state in vivo. KPC-luciferase cells orthotopically implanted in mice treated with oxaliplatin, cPLA2 inhibitor PYR, or both show an increased SG index in tumors that received oxaliplatin treatment alone, correlating with a higher percentage of G2 phase cells and their ability to promote SG formation. PYR inhibited SG formation in Geminin-positive (S/G2) cells, but not Geminin-negative cells.","40099649","Q13283,Q04637"
"DEE660B4","DOID:3498","Immunofluorescence assays of MIA PaC-2 cells show G3BP2 promotes PDAC gemcitabine resistance in a stress granule (SG) dependent manner. TCGA dataset show that G3BP1 and G3BP2 are significantly upregulated in PDAC, with high expression of G3BP2 associated with poor overall survival. mRNA stability assays show SG in G3BP2 knockdown cells under stress have diminished levels of of PDIA3 mRNA. Knockdown of G3BP2 inhibited the proliferation and invasion of PANC‐1 and CFPAC-1 cells in vitro and in vivo. DKC1 was identified as a target of G3BP2, and PDIA3 mRNA stability increased through recruitment to stress granules by G3BP2.","39289547","Q9UN86"
"804901D1","DOID:3498","Analysis of a large-scale integrated dataset of human PDACs and a panel of 12 human PDAC cell lines, demonstrated that SIRT6 gene expression levels were higher in classical PDAC compared to basal PDAC samples. SIRT6 protein expression ATF4 is stabilized, and protected from degradation, and relocalized to nuclear speckles by binding to SIRT6 in Panc3.27 cell lines overexpressing SIRT6 and ATF4. In PDX models, tumor growth of basal but nor classical tumors was inhibited by treatment with flavopiridol, an ATP-competitive CDK9 inhibitor).","37134154","Q01130"
"DEE660B4","DOID:3498","NUPR1 undergoes LLPS in vitro homotypically and heterotypically, in the presence of RNA.  NUPR1 colocalizes with G3BP1 in arsenate-induced stress granules (SGs), and promotes induction of a larger number of SGs per cell, compared to cells with NUPR1 knock-down. KRAS-G12D mutation induces overexpression of NUPR1 and formation of NUPR1-dependent SGs in pancreatic cancer cells. Inihbition of NUPR1 with ZZW-115 induces cell death in KRAS-G12D-activated cells. ZZW-115 treatment prevents NUPR1-dependent SG induction and inhibits PDAC development in vivo in Pdx1-cre;LSL-Kras-G12D mouse models.","38360999","Q13283,O60356"
"DEE660B4","DOID:5394","Cholesterol enhanced resistance of MMQ cell lines to cabergoline, and in vivo experiments revealed that a high-cholesterol diet for six weeks resulted in elevated levels of cholesterol and triglycerides in nude mice. Immunoprecipitation combined with mass spectrometry show cholesterol increased binding affinity between DRD2 and stress granule (SG) protein G3BP1. Fluorescence staining of SGs using TASG in MMQ cells, immunohistochemical staining of G3BP1 in mice tumor xenografts, and immunohistochemical staining of G3BP1 in sensitive and resistant human prolactinomas show that cholesterol promoted the formation of stress granules. Interfering with the formation of SGs by overexpressing of USP10 and using the small molecule Integrated Stress Response Inhibitor (ISRIB) reversed cholesterol�s effect on DRD2 cellular distribution and DA resistance in MMQ cells.","40281543","Q13283"
"886620B0","DOID:11260","Negri bodies are viral factories containing viral proteins P and N and form in the cytoplasm of cells infected with the Rabies virus (RABV). They exhibit liquid-like properties as evidenced by fusion observed with live imaging, and P protein fluoerescence recovers within seconds in FRAP experiments. Negri bodies are not miscible with stress granules.","28680096","na"
"DEE660B4","DOID:11260","Stress granule (SG) induction by infection of 293T cells with the avirulent Rabies virus strain Ni-CE; the more virulent strains Nishigahara and street RABV, show reduced induction of SGs. Supression of SG induction is dependent on the sequence of the viral RABV matrix protein (RABV-M), primarily at positions 29 and 95. Variability at position 95 in RABV-M leads to phosphorylation of eiF2a in Ni-CE infected cells, but not cells infected with the more virulent strains. Cells infected with virus expressing RABV-M capable of inducing SGs stimulates RIG-I accumulation and initiation of IFN-b transcription.","36069552","Q01085,Q13283,P31483"
"DEE660B4","DOID:11260","Pseudorabies virus (PRV) infection inhibits SG formation in PK15 and H1299 cells. PK-15 cells infected with PRV show PRV infection promotes G3BP1 nuclear translocation in infected host cells. Confocal microscopy and statistical analyses of SG formation showed that expression of IE180 significantly inhibited poly(I:C)- or arsenite-induced SG formation as compared with US1. Co-immunoprecipitation (co-IP) assays report the interaction between PRV IE180 and endogenous G3BP1 in PRV-infected PK-15 cells, and immunofluorescence assays showed that both GFP-G3BP1 and GFP-G3BP2 colocalized with IE180 protein in the nucleus. H1299 G3BP knockout cell lines show that viral gB protein expression levels were substantially increased in PRV-infected H1299 G3BP1−/− cells compared to WT, and the viral titer in PRV-infected H1299 G3BP1−/− cells was significantly higher than WT.","40145738","Q9UN86,Q13283,P31483"
"DEE660B4","DOID:8947","SGs were detected in retinal ganglion cells in rat models, and exhibited heightened SG formation in response to prolonged light exposure.","39813056","Q13283"
"DEE660B4","DOID:0050211","African swine fever virus (ASFV) inhibits stress granule formation in Porcine pulmonary alveolar macrophages (PAMs) despite SG induction via Ars. ASFV increases intracellular GSH by upregulating mitochondrial pAIFM1, and inhibition of ferroptosis pathway factors. GSH inhibitor BSO and activator NAC promotes SG formation in mock-infected PAMs.","39707514","Q13283"
"B5B9A610","DOID:10456","Adenovirus capsid protein VI accumulates into PML bodies upon viral entry in infected U2OS cells and displaces Daxx from PML bodies and translocates it into the cytoplasm, to I nhibit Daxx-mediated repression of the immediate early Ad E1A promoter..","22427750","P29590"
"1A18FFC4","DOID:9352","Paraspeckle dynamics regulate gluconeogenesis in hepatocytes. Diabetes-relevant proline levels inhibit formation of paraspeckles in hepatocytes via suppression of Neat1 expression by NONO binding, and promotes hepatic gluconeogenesis through paraspeckle mRNA retention axis in mice. Proline selectively regulated paraspeckle mRNA retention of metabolism-related mRNA and expression of PGC1α and FOXO1 hepatocytes, with Ppargc1a and Foxo1 mRNAs colocalizing with Neat1 in the nucleus. Modulating paraspeckle dynamics ameliorates hyperglycaemia in diabetic mice.","39820557","Q15233"
"650D5353","DOID:646","CHPV proteins nucleocapsid (N), phosphoprotein (P) and large (L) form cytoplasmic inclusion bodies (CHPV-IBs) and recruit host stress granule proteins (TIA-1, PABP1, eIFη, G3BP1, Ago2) in CHPV infected Vero and N2A cells. CHPV-IB form independently of PKR and eIF2a phosphorylation, but recruit PKR to promote viral replication.","39066190","P11940,Q13283,P31483,O15372"
"DEE660B4","DOID:0080180","Zika virus strain GUINEA-18 suppresses stress granule formation in response to osmitoc and oxidative stress, to promote lower viral replication rates, innate immune response and weaker cytotoxicity compared to a strain that does not suppress stress granule formation, in infected A549 cells.","38968296","Q13283"
"DEE660B4","DOID:0080180","ZIKV protein NS2B promotes eIF2α dephosphorylation through a PP1α-dependent mechanism, to inhibit stress granule (SG) formation under oxidative stress, and evade the host antiviral response in infected HeLa cells. The NS2B-mediated mechanism of SG suppression is shared among multiple members of the flavivirus family: Dengue, West Nile, Yellow Fever, Zika and Japanese encephalitis virus.","38935808","Q13283,P31483"
"DEE660B4","","Co-staining for hnRNPA2/B1 and TIA1 show hnRNPA2/B1 localizes to stress granules (SGs) in aged mild cognitive impairment (MCI) rats after surgery with diverse anaesthetics. Confocal imagery show on the second postoperative day of MCI rats, hnRNPA2/B1 in the hippocampus of rats in the Scramble-­shRNA group translocated to the nucleus and form hnRNPA2/B1-­SGs in the perinuclear area. FRAP of rat primary hippocampal neurons transfected with RUVBL2-siRNA or NC-siRNA and mCherry-hnRNPA2/B1 shows that RUVBL2 mediates the transition of hnRNPA2/B1 SGs from the hydrogel phase to the liquid phase. Deffective clearance of SGs formed after sevoflurane exposure requires RUVBL2 knockdown.","39610020",""
"232F8A39","","Cisplatin induces processing bodies (PB) disassembly and SG-like granule formation in A549 cells, but not in A549/DDP cells, a drug resistant NSCLC cell line, with cisplatin-induced PB disassembly occuring prior to SG-like granule formation. Also,  cisplatin effectively killed A549 cells but was less toxic to A549/DDP cells, suggesting that the development of cisplatin resistance was closely related to the regulation of PBs and SG-like granules within the cancer cells. Cycloheximide (CHX) pre-treatment significantly increased the cell death of cisplatin-treated A549/DDP cells. Additionally, combination treatment with pyrvinium overcomes cisplatin resistance via mediating PB disassembly and SG-like granule assembly in cisplatin-resistant cells.","40247038","P26196,Q13283"
"DEE660B4","","PRV infection inhibits oxidative stress-induced stress granule (SG) formation in infected Vero and PK-15 cells, inhibited eIF2a phosphorylation, and activated PKR and PERK kinases during the early infection stage, to facilitate virus replication.","32768230","Q13283"
"DEE660B4","","Infection of A549 cells with reovirus induces stress granule (SG) formation, independent of PKR, HRI, PERK or GCN. Viral σ3 double-stranded RNA-binding protein inhibits SG formation and activation of PKR in infected A549 cells, promoting viral replication. A virus harboring the K287T mutation which inhibits σ3’s dsRNA-binding ability, was less virulent compared to the wild-type, in vivo, in infected neonatal C57BL/6 mice,and prevented these animal from developing myocarditis.","34237110","Q01085,Q13283"
"DEE660B4","","Stress granule (SG) formation is induced during early infection and inhibited in late stages EV-D68 infection in 293T cells. EV-D68 infection induces PKR and eIF2a phosphorylation-dependent SGs. Overexpression of SG proteins, G3BP1, TIA-1 or HUR, inhibit viral replication. SG proteins interact with 3' UTR of viral RNA to inhibit viral replication. Inhibition of stress SG assembly during late infection stages via cleavage of G3BP1 by 3Cpro protease.","31941779","Q13283,P31483,Q15717"
"718A9EC3","","p62 knock-in mice with diminished KEAP1 binding or entirely lacking KEAP1 retention were crossbred with Atg7flox/flox;Alb-Cre mice. Hematoxylin, eosin, and CK19 staining show that the level of KEAP1 retention in p62 bodies determines the severity of liver pathology in the hepatocyte-specific Atg7-knockout mice with different p62 mutations. Immunofluorescence of primary cultured hepatocytes--accumulating p62 bodies that sequester KEAP1,  reduced KEAP1 retention in p62 bodies, and accumulating p62 bodies with minimal KEAP1 retention, subsequently revealing that KEAP1 is sequestered into p62 bodies based on its binding affinity to p62. Immunoblot analysis of these mouse models show autophagy degrades KEAP1 incorporated into p62 bodies but not than cytosolic KEAP1. Furthermore, quantitative real-time PCR analysis confirmed that NRF2 target genes were upregulated in Atg7-KO mouse livers but suppressed in a stepwise manner when wild-type p62 was replaced with p62S351A or p62T352A, with Sqstm1 expression upregulated in Atg7-KO livers and reversed by substituting wild-type p62 with either mutant. Immunoblot analysis showed significant increases in NRF2 target proteins, overall demonstrating transcriptomic changes caused by Atg7 deficiency involving the NRF2 pathway are dependent on the binding affinity of KEAP1 to p62 bodies, with cytoplasmic proteome profiling of the mice livers confirming proteome-wide changes driven by KEAP1-p62 binding.","40437287",""
"91857CE7","","HNRNPK protein levels were found to be elevated in bone marrow samples of patients with ribosomopathies that cause bone marrow failure. HnrnpkTg mice had quicker exhaustion rates, showed bone marrow failure, lifespan reduction and an aging phenotype, partially rescued by p53-haploinsufficiency. HNRNPK-overexpressing mouse models showed a significant enrichment of a set of downregulated genes and proteins involved in ribosome biogenesis (RiBi) and rRNA processing, with nucleolin immunolabeling and electron microscopy analysis showing an increased number of nucleoli, as well as smaller nucleoli. Additionally, nucleolar alterations including segregation of components at the nucleolar periphery, abnormal accumulations of the granular component, nucleolar lobulation and gramentation, and formation of prominent masses of repressive heterochromatin. HNRNPK overexpression disrupted normal ribosomal biogenesis, leading to altered rRNA processing and aberrant rRNA precursor levels, and nucleolar stress derived from HNRNPK overexpression promoted cell cycle arrest and senescence via p53.","40338663",""
"5FC38D49","","LLPS of NS80 drives formation of GCRV viroplasms, and an NS80 mutant and a reagent inhibts LLPS. Viroplasms (VL) form membraneless organelles which coalesce within the cytoplasm of GCRV-infected cells where liquid-like properties recruit viral dsRNA, viral RdRp, and viral proteins. The liquid-like properties of VLs are essential for viral replication, assembly, and immune evasion, and LLPS is essential for VLs to recruit viral proteins for virion assembly. GCO cells transfected with NS38-mCherry plasmid and infected with GCRV showed that most viral dsRNA was concentrated within VLs in the presence of GCRV. In the absence of GCRV infection, EGFP-tagged viral proteins distribute uniformly in the cytoplasm or throughout cells, except for NS80-EGFP which formed VLs. However, in transfected cells infected with GCRV, all EGFP-tagged viral proteins co-aggregate within NS38-mCherry VLs.","39194247",""
"2AFE1BD8","","RdRp of pandemic GII.4 HuNoV forms condensates in infected HIE cells, and is ablated by knockdown of the NTD region in vitro. Uninfected HIEs did not form condensates. Colocalization of dsRNA and VPg indicate condensates as sites for viral replication. Concentration of RdRp is ~20 times higher in condensates than in the dilute phase, and is enzymatically active.","39705355",""
